图片名称,销售方
vat_0027.jpeg,北京坤鸿睿科技有限公司
vat_0031.jpeg,"根据发票上的信息,销售方名称是北京宇者天下科技有限公司。"
vat_0011.jpeg,维作大成(北京)科技有限公司
vat_0046.jpeg,北京科学技术馆团购公司
vat_0050.jpeg,中国科学院自动化研究所
vat_0007.jpeg,北京恒鸥盛科技有限公司
vat_0006.jpeg,中国科学院自动化研究所
vat_0047.jpeg,北京中自营车技术服务有限公司
vat_0010.jpeg,北京宇昌天下科技有限公司
vat_0030.jpeg,上海韵束电子商务有限公司北京分公司
vat_0026.jpeg,培训送(北京)教育管理有限公司
vat_0017.jpeg,销售方名称是:科瑞管理(北京)管理管理有限公司
vat_0040.jpeg,销售方名称是阿里云计算有限公司。
vat_0001.jpeg,中国科学院自动化研究所
vat_0021.jpeg,中国科学院自动化研究所
vat_0037.jpeg,北京中自自控技术有限公司
vat_0036.jpeg,苏州艾知伺服科技有限公司
vat_0020.jpeg,苏州钻和伺服科技有限公司
vat_0041.jpeg,中国科学院自动化研究所
vat_0016.jpeg,销售方名称是北京易鼎木科技发展有限公司。
vat_0003.jpeg,科天电气股份有限公司
vat_0042.jpeg,北京捷伟视通发票
vat_0015.jpeg,山西大学
vat_0039.jpeg,北京中百百佳超市有限公司
vat_0019.jpeg,中国科学院自动化研究所
vat_0035.jpeg,上海马弗电子商务有限公司北京分公司
vat_0023.jpeg,佳作天成(北京)科技有限公司
vat_0022.jpeg,北京美伙餐饮管理有限公司
vat_0034.jpeg,北京中昌自住住宅用房地产开发有限公司
vat_0018.jpeg,科大讯飞股份有限公司
vat_0038.jpeg,北京中自百祥技术服务有限公司
vat_0014.jpeg,销售方名称是中国科学院自动化研究所。
vat_0043.jpeg,销售方名称是中国科学院自然科学研究所
vat_0002.jpeg,中国科学院自动化研究所
vat_0009.jpeg,根据发票上的信息，销售方名称是北京恒滦腾科技有限公司。
vat_0048.jpeg,中国科学院自动化研究所
vat_0033.jpeg,北京宇宙天下科技有限公司
vat_0025.jpeg,中国科学院自动化研究所
vat_0005.jpeg,销售方名称是中国科学院自动化研究所。
vat_0044.jpeg,北京恒腾合力科技有限公司
vat_0013.jpeg,销售方名称是北京天通商贸有限公司。
vat_0029.jpeg,中国科学院自动化研究所
vat_0028.jpeg,销售方名称是:佳佳天成(北京)科技有限公司
vat_0012.jpeg,佳作天成(北京)科技有限公司
vat_0045.jpeg,华育申自电技术服务有限公司
vat_0004.jpeg,中国科学院自动化研究所
vat_0024.jpeg,阿里云计算有限公司
vat_0032.jpeg,北京宇笙大厦下料技术有限公司
vat_0049.jpeg,"根据图像中的发票信息,销售方名称是中国科学院自动化研究所。"
vat_0008.jpeg,销售方名称是:佰洲达(北京)餐饮管理有限公司
